Stem,Tipo,Folio_Origen,Categoria,Identificacion,Confianza,N_Candidatos,Metodo,Cadena_Razonamiento,Verificacion_Visual
K1K2A1,Exclusivo,f17v,ACTIVO,Galbanum,ALTA (99%),1,Constraint Solver + Recipe Profile Match,"1) K1K2A1 es ACTIVO en Ung.Apostolorum, Diascordium, y Theriac Magna (consistencia 100%). 2) Interseccion de ACTIVOS de las 3 recetas = {Galbanum} (unico). 3) Perfil de recetas historicas: Galbanum es el UNICO ingrediente ACTIVO presente en exactamente estas 3 recetas y ninguna otra de nuestra base de datos. 4) Galbanum es una goma-resina de la planta Ferula galbaniflua, ingrediente clasico de unguentos y antidotos medievales.",Folio f17v en voynich.nu: buscar planta con hojas pinnadas tipo umbelifera (Ferula)
BaA3,Exclusivo,f33v,ACTIVO (clase semantica),CLASE: Goma-resina vegetal (Opopanax / Diagridium / Terebinthina),ALTA (90%),1,Eliminacion + Analisis Semantico de Clase,"1) BaA3 es ACTIVO en Ung.Apostolorum, Pillulae Aureae, y Theriac Magna. 2) Interseccion directa = VACIA (ningun ingrediente es ACTIVO en las 3). 3) PERO: despues de eliminar K1K2A1=Galbanum de Ung.Apostolorum, los ACTIVOS restantes que tambien estan en Theriac = {Aristolochia, Opopanax}. 4) Ninguno de estos esta en Pillulae Aureae -> CONFLICTO aparente. 5) RESOLUCION: Las 3 asignaciones posicionales eran: Galbanum/Opopanax (Ung.Apost), Diagridium (Pill.Aureae), Terebinthina (Theriac). 6) TODAS son gomas-resinas vegetales (exudados de plantas). 7) Conclusion: BaA3 no es un ingrediente especifico sino una CLASE FUNCIONAL = 'goma-resina'. Esto es coherente con la practica medieval de usar terminos genericos.",Folio f33v: buscar planta con latex/resina visible
U2J1A1,Exclusivo,f52v,ACTIVO (farmaco potente),CLASE: Farmaco narctico/purgante potente (Opium / Aloe),MEDIA (70%),2,Consistencia Categorica + Analisis Funcional,"1) U2J1A1 es ACTIVO tanto en Diascordium (asignado=Opium) como en Pill.Aureae (asignado=Aloe). 2) Interseccion directa = VACIA (Opium no esta en Pill.Aureae, Aloe no en Diascordium). 3) Patron similar a BaA3: ambos son los ingredientes ACTIVOS principales de sus recetas. 4) Opium y Aloe comparten: son los farmacos mas potentes/primarios de cada formula. 5) Hipotesis: U2J1A1 = 'ingrediente activo principal' o un narcotico/purgante potente. 6) Si es un ingrediente especifico, Opium es mas probable (aparece en mas recetas medievales).",Folio f52v: buscar Papaver somniferum (amapola) o Aloe vera
D1A1Q1J1A1,Exclusivo,f49r,ACTIVO,Squilla | Petroselinum | Phu/Valeriana | Acorus calamus (4 candidatos exactos),MEDIA-BAJA (50%),4,Constraint Solver - perfil exacto,"1) D1A1Q1J1A1 es ACTIVO en Aurea Alexandrina y Theriac Magna. 2) Ingredientes ACTIVOS exclusivos de este par = {Squilla, Petroselinum, Phu, Acorus calamus}. 3) Tambien posibles (superset): Opium, Castoreum, Hypericum. 4) Si U2J1A1=Opium, se descarta Opium de esta lista. 5) El stem tiene 60 apariciones en recetas (frecuencia alta) -> ingrediente comun. 6) Squilla (escila) o Valeriana son mas probables por su rol clasico en antidotos.",Folio f49r: buscar planta bulbosa (Squilla) o de raiz grande (Valeriana)
K1A3,Generico,multiple (10 folios botanica),ESPECIA,Cinnamomum | Crocus (2 candidatos),MEDIA-ALTA (75%),2,Constraint Solver - interseccion reducida,"1) K1A3 es ESPECIA en Pillulae Aureae y Theriac Magna. 2) Solo 2 ESPECIAS compartidas: Cinnamomum (canela) y Crocus (azafran). 3) K1A3 aparece en 74 instancias en recetas -> muy frecuente. 4) Cinnamomum es la especia mas frecuente en formularios medievales. 5) Si L1A1 o D1A1Q1K1A1 resultan ser Cinnamomum, K1A3=Crocus automaticamente.","Stem generico - aparece en 10 folios de botanica, sin planta unica"
L1A1,Generico,multiple (23 folios botanica),ESPECIA,Cinnamomum | Piper longum | Zingiber (3 candidatos),MEDIA (60%),3,Constraint Solver,"1) L1A1 es ESPECIA en Diascordium y Theriac Magna. 2) 3 ESPECIAS compartidas: Cinnamomum, Piper longum, Zingiber. 3) L1A1 aparece en 66 instancias en recetas. 4) Las 3 son especias universales en farmacia medieval. 5) Resolver K1A3 primero (2 candidatos) podria reducir este pool.",Stem generico - 23 folios botanica
D1A1Q1K1A1,Generico,multiple (6 folios botanica),ESPECIA,Cinnamomum | Piper longum | Zingiber (3 candidatos),MEDIA (60%),3,Constraint Solver,"1) D1A1Q1K1A1 es ESPECIA en Diascordium y Aurea Alexandrina. 2) Mismo pool que L1A1: {Cinnamomum, Piper longum, Zingiber}. 3) Sin embargo, aparece en recetas diferentes que L1A1 -> son ingredientes DISTINTOS. 4) Si L1A1 = Zingiber, entonces D1A1Q1K1A1 = Cinnamomum o Piper longum.",6 folios botanica
